{
  "$schema": "https://json-schema.org/draft/2020-12/schema",
  "$id": "https://github.com/cdeust/harness-comparison/schemas/benchmark-protocol-v1.schema.json",
  "title": "Benchmark protocol v1",
  "description": "Pre-execution research contract for one benchmark release.",
  "type": "object",
  "additionalProperties": false,
  "required": [
    "schemaVersion",
    "protocolId",
    "title",
    "registeredAt",
    "researchQuestion",
    "systemBoundary",
    "evidenceSources",
    "hypotheses",
    "nonClaims",
    "populations",
    "experimentalUnits",
    "adapters",
    "corpora",
    "modelPolicy",
    "resourcePolicy",
    "operationPolicy",
    "workload",
    "metrics",
    "repetitions",
    "stopRule",
    "scoringRubric",
    "plannedCells",
    "declaredDeviations"
  ],
  "properties": {
    "schemaVersion": { "const": "benchmark-protocol/v1" },
    "protocolId": { "$ref": "#/$defs/nonEmptyString" },
    "title": { "$ref": "#/$defs/nonEmptyString" },
    "registeredAt": { "$ref": "#/$defs/utcTimestamp" },
    "researchQuestion": { "$ref": "#/$defs/nonEmptyString" },
    "systemBoundary": { "$ref": "#/$defs/nonEmptyString" },
    "evidenceSources": {
      "type": "array",
      "minItems": 1,
      "items": {
        "type": "object",
        "additionalProperties": false,
        "required": ["id", "citation", "claim"],
        "properties": {
          "id": { "$ref": "#/$defs/nonEmptyString" },
          "citation": { "$ref": "#/$defs/nonEmptyString" },
          "claim": { "$ref": "#/$defs/nonEmptyString" }
        }
      }
    },
    "hypotheses": {
      "type": "array",
      "minItems": 1,
      "items": {
        "type": "object",
        "additionalProperties": false,
        "required": ["id", "statement", "falsifier"],
        "properties": {
          "id": { "$ref": "#/$defs/nonEmptyString" },
          "statement": { "$ref": "#/$defs/nonEmptyString" },
          "falsifier": { "$ref": "#/$defs/nonEmptyString" }
        }
      }
    },
    "nonClaims": {
      "type": "array",
      "minItems": 1,
      "items": { "$ref": "#/$defs/nonEmptyString" }
    },
    "populations": {
      "type": "array",
      "minItems": 1,
      "items": {
        "type": "object",
        "additionalProperties": false,
        "required": ["id", "description", "inclusion", "exclusion"],
        "properties": {
          "id": { "$ref": "#/$defs/nonEmptyString" },
          "description": { "$ref": "#/$defs/nonEmptyString" },
          "inclusion": { "$ref": "#/$defs/nonEmptyString" },
          "exclusion": { "$ref": "#/$defs/nonEmptyString" }
        }
      }
    },
    "experimentalUnits": {
      "type": "array",
      "minItems": 1,
      "items": {
        "type": "object",
        "additionalProperties": false,
        "required": ["id", "description", "components"],
        "properties": {
          "id": { "$ref": "#/$defs/nonEmptyString" },
          "description": { "$ref": "#/$defs/nonEmptyString" },
          "components": {
            "type": "array",
            "minItems": 1,
            "items": { "$ref": "#/$defs/nonEmptyString" }
          }
        }
      }
    },
    "adapters": {
      "type": "array",
      "minItems": 1,
      "items": {
        "type": "object",
        "additionalProperties": false,
        "required": ["id", "path", "runtimeId", "interface"],
        "properties": {
          "id": { "$ref": "#/$defs/nonEmptyString" },
          "path": { "$ref": "#/$defs/nonEmptyString" },
          "runtimeId": { "$ref": "#/$defs/nonEmptyString" },
          "interface": { "$ref": "#/$defs/nonEmptyString" }
        }
      }
    },
    "corpora": {
      "type": "array",
      "minItems": 1,
      "items": {
        "type": "object",
        "additionalProperties": false,
        "required": ["id", "repository", "revision", "dirty"],
        "properties": {
          "id": { "$ref": "#/$defs/nonEmptyString" },
          "repository": { "$ref": "#/$defs/nonEmptyString" },
          "revision": { "$ref": "#/$defs/gitRevision" },
          "dirty": { "type": "boolean" }
        }
      }
    },
    "modelPolicy": {
      "type": "object",
      "additionalProperties": false,
      "required": ["provider", "model", "versionPolicy", "parameters", "networkUse"],
      "properties": {
        "provider": { "$ref": "#/$defs/nonEmptyString" },
        "model": { "$ref": "#/$defs/nonEmptyString" },
        "versionPolicy": { "$ref": "#/$defs/nonEmptyString" },
        "parameters": { "type": "object" },
        "networkUse": { "$ref": "#/$defs/nonEmptyString" }
      }
    },
    "resourcePolicy": {
      "type": "object",
      "additionalProperties": false,
      "required": ["description", "limits", "evidenceSourceIds"],
      "properties": {
        "description": { "$ref": "#/$defs/nonEmptyString" },
        "limits": {
          "type": "object",
          "additionalProperties": { "$ref": "#/$defs/evidencedValue" }
        },
        "evidenceSourceIds": { "$ref": "#/$defs/evidenceSourceIds" }
      }
    },
    "operationPolicy": {
      "type": "object",
      "additionalProperties": false,
      "required": ["adapterId", "orderedOperations", "retryPolicy", "interruptionPolicy"],
      "properties": {
        "adapterId": { "$ref": "#/$defs/nonEmptyString" },
        "orderedOperations": {
          "type": "array",
          "minItems": 1,
          "items": {
            "type": "object",
            "additionalProperties": false,
            "required": ["id", "description", "parameters"],
            "properties": {
              "id": { "$ref": "#/$defs/nonEmptyString" },
              "description": { "$ref": "#/$defs/nonEmptyString" },
              "parameters": {
                "type": "array",
                "items": {
                  "type": "object",
                  "additionalProperties": false,
                  "required": ["id", "value", "unit", "rationale", "evidenceSourceIds"],
                  "properties": {
                    "id": { "$ref": "#/$defs/nonEmptyString" },
                    "value": {},
                    "unit": { "$ref": "#/$defs/nonEmptyString" },
                    "rationale": { "$ref": "#/$defs/nonEmptyString" },
                    "evidenceSourceIds": { "$ref": "#/$defs/evidenceSourceIds" }
                  }
                }
              }
            }
          }
        },
        "retryPolicy": { "$ref": "#/$defs/sourcedPolicy" },
        "interruptionPolicy": { "$ref": "#/$defs/sourcedPolicy" }
      }
    },
    "workload": {
      "type": "object",
      "additionalProperties": false,
      "required": [
        "concurrencyLevels",
        "callRate",
        "callCount",
        "duration",
        "completionCondition",
        "warmColdPolicy",
        "faultSchedule",
        "quantileMethod",
        "parameterSpace",
        "cellOrder"
      ],
      "properties": {
        "concurrencyLevels": { "$ref": "#/$defs/evidencedValue" },
        "callRate": { "$ref": "#/$defs/evidencedValue" },
        "callCount": { "$ref": "#/$defs/evidencedValue" },
        "duration": { "$ref": "#/$defs/evidencedValue" },
        "completionCondition": { "$ref": "#/$defs/sourcedPolicy" },
        "warmColdPolicy": { "$ref": "#/$defs/sourcedPolicy" },
        "faultSchedule": {
          "type": "array",
          "items": {
            "type": "object",
            "additionalProperties": false,
            "required": ["id", "operationId", "description", "trigger"],
            "properties": {
              "id": { "$ref": "#/$defs/nonEmptyString" },
              "operationId": { "$ref": "#/$defs/nonEmptyString" },
              "description": { "$ref": "#/$defs/nonEmptyString" },
              "trigger": { "$ref": "#/$defs/evidencedValue" }
            }
          }
        },
        "quantileMethod": { "$ref": "#/$defs/sourcedPolicy" },
        "parameterSpace": {
          "type": "object",
          "minProperties": 1,
          "additionalProperties": { "$ref": "#/$defs/evidencedValue" }
        },
        "cellOrder": {
          "type": "array",
          "minItems": 1,
          "items": { "$ref": "#/$defs/nonEmptyString" }
        }
      }
    },
    "metrics": {
      "type": "array",
      "minItems": 1,
      "items": {
        "type": "object",
        "additionalProperties": false,
        "required": ["id", "definition", "unit", "summary"],
        "properties": {
          "id": { "$ref": "#/$defs/nonEmptyString" },
          "definition": { "$ref": "#/$defs/nonEmptyString" },
          "unit": { "$ref": "#/$defs/nonEmptyString" },
          "summary": { "$ref": "#/$defs/nonEmptyString" }
        }
      }
    },
    "repetitions": {
      "type": "object",
      "additionalProperties": false,
      "required": ["count", "unit", "rationale", "evidenceSourceIds"],
      "properties": {
        "count": { "type": "integer", "minimum": 1 },
        "unit": { "$ref": "#/$defs/nonEmptyString" },
        "rationale": { "$ref": "#/$defs/nonEmptyString" },
        "evidenceSourceIds": { "$ref": "#/$defs/evidenceSourceIds" }
      }
    },
    "stopRule": {
      "type": "object",
      "additionalProperties": false,
      "required": ["description", "onSuccess", "onFailure", "evidenceSourceIds"],
      "properties": {
        "description": { "$ref": "#/$defs/nonEmptyString" },
        "onSuccess": { "$ref": "#/$defs/nonEmptyString" },
        "onFailure": { "$ref": "#/$defs/nonEmptyString" },
        "evidenceSourceIds": { "$ref": "#/$defs/evidenceSourceIds" }
      }
    },
    "scoringRubric": {
      "type": "object",
      "additionalProperties": false,
      "required": ["procedure", "independent", "labels"],
      "properties": {
        "procedure": { "$ref": "#/$defs/nonEmptyString" },
        "independent": { "type": "boolean" },
        "labels": {
          "type": "array",
          "minItems": 1,
          "items": {
            "type": "object",
            "additionalProperties": false,
            "required": ["id", "definition"],
            "properties": {
              "id": { "$ref": "#/$defs/nonEmptyString" },
              "definition": { "$ref": "#/$defs/nonEmptyString" }
            }
          }
        }
      }
    },
    "plannedCells": {
      "type": "array",
      "minItems": 1,
      "items": {
        "type": "object",
        "additionalProperties": false,
        "required": [
          "id",
          "populationId",
          "experimentalUnitId",
          "corpusId",
          "adapterId",
          "expectedVerdict",
          "parameters"
        ],
        "properties": {
          "id": { "$ref": "#/$defs/nonEmptyString" },
          "populationId": { "$ref": "#/$defs/nonEmptyString" },
          "experimentalUnitId": { "$ref": "#/$defs/nonEmptyString" },
          "corpusId": { "$ref": "#/$defs/nonEmptyString" },
          "adapterId": { "$ref": "#/$defs/nonEmptyString" },
          "expectedVerdict": { "enum": ["proven", "blocked"] },
          "parameters": {
            "type": "object",
            "minProperties": 1,
            "additionalProperties": { "$ref": "#/$defs/jsonValue" }
          }
        }
      }
    },
    "declaredDeviations": {
      "type": "array",
      "items": {
        "type": "object",
        "additionalProperties": false,
        "required": ["id", "description", "rationale"],
        "properties": {
          "id": { "$ref": "#/$defs/nonEmptyString" },
          "description": { "$ref": "#/$defs/nonEmptyString" },
          "rationale": { "$ref": "#/$defs/nonEmptyString" }
        }
      }
    }
  },
  "$defs": {
    "nonEmptyString": { "type": "string", "minLength": 1 },
    "gitRevision": { "type": "string", "pattern": "^[0-9a-f]{40}$" },
    "evidenceSourceIds": {
      "type": "array",
      "minItems": 1,
      "items": { "$ref": "#/$defs/nonEmptyString" }
    },
    "jsonValue": {
      "oneOf": [
        { "type": "null" },
        { "type": "string" },
        { "type": "number" },
        { "type": "boolean" },
        {
          "type": "array",
          "items": { "$ref": "#/$defs/jsonValue" }
        }
      ]
    },
    "evidencedValue": {
      "type": "object",
      "additionalProperties": false,
      "required": ["value", "unit", "rationale", "evidenceSourceIds"],
      "properties": {
        "value": {},
        "unit": { "$ref": "#/$defs/nonEmptyString" },
        "rationale": { "$ref": "#/$defs/nonEmptyString" },
        "evidenceSourceIds": { "$ref": "#/$defs/evidenceSourceIds" }
      }
    },
    "sourcedPolicy": {
      "type": "object",
      "additionalProperties": false,
      "required": ["description", "evidenceSourceIds"],
      "properties": {
        "description": { "$ref": "#/$defs/nonEmptyString" },
        "evidenceSourceIds": { "$ref": "#/$defs/evidenceSourceIds" }
      }
    },
    "utcTimestamp": {
      "type": "string",
      "pattern": "^\\d{4}-\\d{2}-\\d{2}T\\d{2}:\\d{2}:\\d{2}(?:\\.\\d+)?Z$",
      "format": "date-time"
    }
  }
}
