{
  "schemaVersion": "benchmark-protocol/v1",
  "protocolId": "2026-08-30-hc-cortex-002-v1",
  "title": "Cortex SQLite request-transaction isolation under concurrent mutations",
  "registeredAt": "2026-08-30T21:10:22Z",
  "researchQuestion": "Does Cortex candidate 9faa80d3f36b1c7fd05edb4aca8202448a79fb27 prevent one concurrent SQLite request from committing or rolling back another request's mutation, while preserving the same operation ledger under the PostgreSQL reference backend?",
  "systemBoundary": "The measured boundary is Cortex safe_handler admission, worker-thread dispatch, request transaction finalization, and the SQLite/PostgreSQL store methods insert_memory, supersede_atomic, and delete_memory. The adapter bypasses embedding, predictive write gating, wiki synchronization, MCP JSON-RPC serialization, the LLM, and host-specific Claude/Codex scheduling so those variables cannot be mistaken for database isolation.",
  "evidenceSources": [
    {
      "id": "research-process",
      "citation": "RESEARCH-PROCESS.md §§1, 3, 4, 5, 5a, 6 and 8 at harness-comparison 6f4c1f27626dc74b7df326ecb15c6260ebd1978e",
      "claim": "The repository requires preregistration, fresh cells, complete workload telemetry, independent evaluation and immutable release artifacts."
    },
    {
      "id": "hc-cortex-002-dossier",
      "citation": "issues/Cortex/scalability/sqlite-transaction-isolation.md at harness-comparison 6f4c1f27626dc74b7df326ecb15c6260ebd1978e",
      "claim": "The dossier requires mixed remember, supersede and forget mutations, a faulted rollback at every level, a second clean run, restart oracles and a matched PostgreSQL reference."
    },
    {
      "id": "baseline-source",
      "citation": "https://github.com/cdeust/Cortex/blob/8f5ae3b87b6969f3abcb3736859febfdab69304a/mcp_server/infrastructure/sqlite_store.py",
      "claim": "The pinned baseline owns one process-wide SQLite connection with cross-thread use enabled."
    },
    {
      "id": "candidate-design",
      "citation": "https://github.com/cdeust/Cortex/blob/9faa80d3f36b1c7fd05edb4aca8202448a79fb27/docs/adr/ADR-0055-sqlite-connection-per-execution-thread.md",
      "claim": "The candidate defines request-scoped native SQLite handles, exact-handle finalization and explicit cancellation non-claims."
    },
    {
      "id": "candidate-admission",
      "citation": "https://github.com/cdeust/Cortex/blob/9faa80d3f36b1c7fd05edb4aca8202448a79fb27/mcp_server/handlers/admission.py#L35-L90",
      "claim": "The remember admission budget is four requests; the fifth concurrent remember is the first source-derived queueing boundary."
    },
    {
      "id": "candidate-request-boundary",
      "citation": "https://github.com/cdeust/Cortex/blob/9faa80d3f36b1c7fd05edb4aca8202448a79fb27/mcp_server/tool_error_handler.py#L150-L229",
      "claim": "safe_handler gates named tools, offloads every handler to a worker thread and enters the request transaction scope around that handler."
    },
    {
      "id": "candidate-regression",
      "citation": "https://github.com/cdeust/Cortex/blob/9faa80d3f36b1c7fd05edb4aca8202448a79fb27/tests_py/infrastructure/test_sqlite_transaction_isolation.py",
      "claim": "The smallest source regression fixes the fault after supersede compare-and-set, pairs it with an acknowledged insert, permits one lock retry, and reconciles memory, FTS, vector, integrity and foreign keys after reopen."
    },
    {
      "id": "hf-1996",
      "citation": "https://doi.org/10.1080/00031305.1996.10473566",
      "claim": "Hyndman and Fan define type-1 sample quantiles as the inverse empirical distribution function based on observed order statistics."
    },
    {
      "id": "sqlite-isolation",
      "citation": "https://www.sqlite.org/isolation.html",
      "claim": "SQLite serializes writers and isolates separate database connections; rollback-mode write contention is observable as locking."
    },
    {
      "id": "postgres-transactions",
      "citation": "https://www.postgresql.org/docs/17/tutorial-transactions.html",
      "claim": "PostgreSQL transactions make intermediate states invisible and commit or roll back as a unit."
    },
    {
      "id": "postgres-local-connections",
      "citation": "https://www.postgresql.org/docs/17/runtime-config-connection.html",
      "claim": "An empty listen_addresses disables TCP/IP listeners; unix_socket_directories selects the local socket directory; port 5432 is the documented default and socket filename suffix; unix_socket_permissions=0700 restricts socket access to its owner."
    },
    {
      "id": "postgres-trust-boundary",
      "citation": "https://www.postgresql.org/docs/17/auth-trust.html",
      "claim": "Trust authentication is acceptable only behind adequate operating-system protection, including a restricted Unix-domain socket directory, and must not be exposed through permissive TCP host rules."
    },
    {
      "id": "postgres-createdb",
      "citation": "https://www.postgresql.org/docs/17/app-createdb.html",
      "claim": "createdb creates a distinct named database, accepts an explicit Unix-domain socket directory and port, can refuse password prompts, and can copy the unmodified template0 database."
    },
    {
      "id": "postgres-hba-view",
      "citation": "https://www.postgresql.org/docs/17/view-pg-hba-file-rules.html",
      "claim": "The pg_hba_file_rules system view exposes one row per active authentication-file rule, including its connection type, authentication method and parse error, for auditable configuration checks."
    },
    {
      "id": "python-to-thread",
      "citation": "https://docs.python.org/3/library/asyncio-task.html#asyncio.to_thread",
      "claim": "Cancelling the awaiting task does not establish that native thread work has stopped, so uncertain attempts require an indeterminate outcome and reconciliation."
    },
    {
      "id": "adapter-contract",
      "citation": "adapters/hc-cortex-002/README.md and adapters/hc-cortex-002/adapter.py in the protocol registration revision",
      "claim": "The deterministic adapter defines fixture arithmetic, append-only event identities, fault choreography, backend observations and the independent restart oracle."
    }
  ],
  "hypotheses": [
    {
      "id": "H1-baseline-red",
      "statement": "At concurrency two, the pinned baseline permits the peer remember to commit the faulted supersede on the shared SQLite connection.",
      "falsifier": "The baseline regression cell records zero rejected-row, supersession-edge and acknowledgement reconciliation violations after restart."
    },
    {
      "id": "H2-candidate-green",
      "statement": "Every candidate SQLite cell isolates the injected supersede rollback from every acknowledged peer mutation.",
      "falsifier": "Any acknowledged mutation has cardinality other than one, any rejected mutation persists, the wrong transaction is removed, or any integrity, foreign-key, FTS or vector oracle fails."
    },
    {
      "id": "H3-postgresql-reference",
      "statement": "The candidate PostgreSQL cells produce the same logical acknowledgement and rejection ledger as the candidate SQLite cells at every preregistered level.",
      "falsifier": "Any PostgreSQL cell has a ledger cardinality, supersession, deletion, vector, full-text, constraint or restart-oracle violation."
    }
  ],
  "nonClaims": [
    "The study does not establish a safe production concurrency above five requests or generalize throughput beyond this synthetic mutation fixture.",
    "The study does not claim that cancelling an asyncio waiter cancels its native worker, and it never relabels a cancelled or transport-lost operation as rejected.",
    "The study does not prove handler-wide atomicity after a store method has already committed; a larger unit-of-work contract is separate work.",
    "The study does not measure embedding, predictive gating, wiki synchronization, MCP serialization, LLM quality, Claude/Codex host parity or complete-stack maturity.",
    "The PostgreSQL reference uses an owner-private, credential-free local Unix-socket service. It does not evaluate authentication, TLS or networked PostgreSQL security, and databases are logically dedicated rather than isolated from other code running as the same operating-system user.",
    "The scored full matrix is POSIX-only on the registered Linux or macOS host and its results are host-specific. Cross-platform validator conformance does not establish Windows workload support.",
    "No external network access is required or intentionally performed, but external egress is neither blocked by an operating-system sandbox nor measured. The pinned source, adapter and runtime execute as trusted code under the same operating-system identity; this study is not a hostile-code isolation or data-loss-prevention evaluation.",
    "The release binds the source locks, interpreter bytes, Python version, package/version inventory and reported native-library versions. It does not claim a byte-identical container, complete software bill of materials, or content hash for every installed package file.",
    "Performance and saturation observations are descriptive; they are not correctness thresholds or winner scores."
  ],
  "populations": [
    {
      "id": "cortex-internal-transaction-boundary",
      "description": "Pinned Cortex baseline and candidate revisions under one deterministic mutation fixture.",
      "inclusion": "safe_handler request dispatch and local store mutations needed to test HC-CORTEX-002.",
      "exclusion": "Other AI Architect components, external harnesses, model behavior and unrelated Cortex handlers."
    }
  ],
  "experimentalUnits": [
    {
      "id": "cortex-baseline",
      "description": "Cortex baseline revision 8f5ae3b87b6969f3abcb3736859febfdab69304a.",
      "components": [
        "safe_handler worker dispatch",
        "process-wide SQLite connection",
        "PostgreSQL pooled store"
      ]